case_text,administrative,criminal,civil,constitutional,family,commercial
Property ownership between Tanmay and Gukesh contested in Buenos Aires court. Startup Delta Airlines sues ex-employee Shivam for leaking trade secrets.,0,0,1,0,0,1
Police arrest Anushka in New York for organized financial fraud. Petition filed by Shouryan regarding violation of free speech rights.,0,1,0,1,0,0
Citizens in Moscow protest changes in election laws.,0,0,0,1,0,0
Ramesh and Sukesh file for divorce citing irreconcilable differences.,0,0,0,0,1,0
Startup Wipro sues ex-employee kshitij for leaking trade secrets.,0,0,0,0,0,1
Mr. Harvijay challenges the new municipal tax regulation in Dubai.,1,0,0,0,0,0
Police arrest Harvijay in Cape Town for organized financial fraud.,0,1,0,0,0,0
Mukti sues Rohit over sudden rental agreement termination.,0,0,1,0,0,0
Startup TCS sues ex-employee Harvijay for leaking trade secrets. Mr. Harvijay challenges the new municipal tax regulation in Dubai.,1,0,0,0,0,1
Rohit sues Fatima over sudden rental agreement termination.,0,0,1,0,0,0
Police arrest Raj in New York for organized financial fraud.,0,1,0,0,0,0
Custody battle between Mahesh and Rakesh in Buenos Aires family court.,0,0,0,0,1,0
Custody battle between Monika and Anshika in Seoul family court.,0,0,0,0,1,0
Police arrest Priya in Johannesburg for organized financial fraud.,0,1,0,0,0,0
Akshay sues Aman over sudden rental agreement termination. Custody battle between Mahesh and Omar in Lima family court.,0,0,1,0,1,0
Citizens in Brisbane protest changes in election laws. Mr. Mohit challenges the new municipal tax regulation in Pune.,1,0,0,1,0,0
Government hiring procedure disputed by Omar from Goa.,1,0,0,0,0,0
Shouryan sues Aman over sudden rental agreement termination.,0,0,1,0,0,0
Startup Wells Fargo sues ex-employee Anshika for leaking trade secrets.,0,0,0,0,0,1
Priya files lawsuit against Simran for breach of partnership terms.,0,0,0,0,0,1
Citizens in Shanghai protest changes in election laws.,0,0,0,1,0,0
Petition filed by Rohit regarding violation of free speech rights. Government hiring procedure disputed by David from Manila.,1,0,0,1,0,0
Startup General Motors sues ex-employee Anushka for leaking trade secrets. Mr. Rakesh challenges the new municipal tax regulation in Jammu.,1,0,0,0,0,1
Police arrest John in Bnaglore for organized financial fraud.,0,1,0,0,0,0
Police arrest Shouryan in Barcelona for organized financial fraud.,0,1,0,0,0,0
Mr. Anjali challenges the new municipal tax regulation in Doha.,1,0,0,0,0,0
Omar is charged with theft at Brussels mall.,0,1,0,0,0,0
Startup Starbucks sues ex-employee Fatima for leaking trade secrets.,0,0,0,0,0,1
Rohit files lawsuit against Anushree for breach of partnership terms. Mr. Utkarsh challenges the new municipal tax regulation in Cairo.,1,0,0,0,0,1
Police arrest Chen in Jammu for organized financial fraud. Petition filed by Rohit regarding violation of free speech rights.,0,1,0,1,0,0
Custody battle between Kunal and Anshika in Riyadh family court.,0,0,0,0,1,0
Petition filed by Aditya regarding violation of free speech rights.,0,0,0,1,0,0
John and Tanmay file for divorce citing irreconcilable differences.,0,0,0,0,1,0
Utkarsh is charged with theft at Rome mall.,0,1,0,0,0,0
Mr. Sunita challenges the new municipal tax regulation in Delhi.,1,0,0,0,0,0
Mr. Fatima challenges the new municipal tax regulation in Sydney.,1,0,0,0,0,0
Amit is charged with theft at Kerela mall.,0,1,0,0,0,0
Custody battle between Yash and Shubham in Istanbul family court.,0,0,0,0,1,0
Yash sues Mohit over sudden rental agreement termination.,0,0,1,0,0,0
David is charged with theft at Brisbane mall. Petition filed by Shivam regarding violation of free speech rights.,0,1,0,1,0,0
Custody battle between Sukesh and John in Bnaglore family court.,0,0,0,0,1,0
Mr. Monika challenges the new municipal tax regulation in Singapore.,1,0,0,0,0,0
Police arrest Omar in London for organized financial fraud.,0,1,0,0,0,0
Petition filed by Chen regarding violation of free speech rights.,0,0,0,1,0,0
Startup Intel Corporation sues ex-employee Rakesh for leaking trade secrets.,0,0,0,0,0,1
Mahesh files lawsuit against Mahesh for breach of partnership terms.,0,0,0,0,0,1
Ramesh files lawsuit against Aaradhya for breach of partnership terms. Government hiring procedure disputed by Shubham from Riyadh.,1,0,0,0,0,1
Startup BMW sues ex-employee Sunita for leaking trade secrets.,0,0,0,0,0,1
Startup Sun Pharma sues ex-employee Akshay for leaking trade secrets. Mr. Sara challenges the new municipal tax regulation in Chennai.,1,0,0,0,0,1
Mr. Piyush challenges the new municipal tax regulation in Riyadh.,1,0,0,0,0,0
Petition filed by Ramesh regarding violation of free speech rights. Mr. Kartikey challenges the new municipal tax regulation in Paris.,1,0,0,1,0,0
Mahesh files lawsuit against Amit for breach of partnership terms. Government hiring procedure disputed by Jatin from Sydney.,1,0,0,0,0,1
Kartikey is charged with theft at Lima mall.,0,1,0,0,0,0
Arpita sues Titiksha over sudden rental agreement termination.,0,0,1,0,0,0
Startup Emirates sues ex-employee Akshay for leaking trade secrets.,0,0,0,0,0,1
Property ownership between Anushree and Shouryan contested in Beijing court.,0,0,1,0,0,0
Property ownership between Shubham and Shivam contested in Madrid court. Custody battle between Jyotir and Utkarsh in Sydney family court.,0,0,1,0,1,0
Petition filed by Anshika regarding violation of free speech rights.,0,0,0,1,0,0
Harvijay sues Shivam over sudden rental agreement termination. Custody battle between Simran and Harvijay in Jammu family court.,0,0,1,0,1,0
Mukti sues Shouryan over sudden rental agreement termination.,0,0,1,0,0,0
Government hiring procedure disputed by David from Kuala Lumpur.,1,0,0,0,0,0
Chen is charged with theft at New York mall.,0,1,0,0,0,0
Utkarsh files lawsuit against Priya for breach of partnership terms. Mr. Mahesh challenges the new municipal tax regulation in Kuala Lumpur.,1,0,0,0,0,1
Simran files lawsuit against Gukesh for breach of partnership terms.,0,0,0,0,0,1
Jatin and Amit file for divorce citing irreconcilable differences.,0,0,0,0,1,0
Police arrest Aditya in Melbourne for organized financial fraud. Petition filed by Aditya regarding violation of free speech rights.,0,1,0,1,0,0
Property ownership between Aaradhya and Omar contested in Dubai court. Yash files lawsuit against Ayesha for breach of partnership terms.,0,0,1,0,0,1
Mukti is charged with theft at Doha mall.,0,1,0,0,0,0
Rakesh and Shubham file for divorce citing irreconcilable differences.,0,0,0,0,1,0
Sudhir sues Arpita over sudden rental agreement termination. Custody battle between Prashant and Arpita in London family court.,0,0,1,0,1,0
Police arrest Fatima in Delhi for organized financial fraud.,0,1,0,0,0,0
Citizens in Barcelona protest changes in election laws.,0,0,0,1,0,0
Petition filed by Priya regarding violation of free speech rights. Mr. Amit challenges the new municipal tax regulation in Goa.,1,0,0,1,0,0
Police arrest Yash in New York for organized financial fraud.,0,1,0,0,0,0
Anushka is charged with theft at Jammu mall. Citizens in Seoul protest changes in election laws.,0,1,0,1,0,0
Priya files lawsuit against Arpita for breach of partnership terms.,0,0,0,0,0,1
Government hiring procedure disputed by Harvijay from Sydney.,1,0,0,0,0,0
Mr. Prashant challenges the new municipal tax regulation in Brisbane.,1,0,0,0,0,0
Simran files lawsuit against Aman for breach of partnership terms.,0,0,0,0,0,1
Sara files lawsuit against Chen for breach of partnership terms. Government hiring procedure disputed by Ayesha from Bnaglore.,1,0,0,0,0,1
Mr. Ayesha challenges the new municipal tax regulation in Barcelona.,1,0,0,0,0,0
Citizens in Johannesburg protest changes in election laws. Mr. Aditya challenges the new municipal tax regulation in London.,1,0,0,1,0,0
Mr. Jyotir challenges the new municipal tax regulation in Riyadh.,1,0,0,0,0,0
Police arrest Yash in Bnaglore for organized financial fraud.,0,1,0,0,0,0
Fatima sues Sukesh over sudden rental agreement termination. Custody battle between Ramesh and Simran in Madrid family court.,0,0,1,0,1,0
Sudhir and Sunita file for divorce citing irreconcilable differences.,0,0,0,0,1,0
Ayesha files lawsuit against Raj for breach of partnership terms.,0,0,0,0,0,1
Piyush files lawsuit against Kunal for breach of partnership terms.,0,0,0,0,0,1
Citizens in Istanbul protest changes in election laws.,0,0,0,1,0,0
Petition filed by Raj regarding violation of free speech rights.,0,0,0,1,0,0
Mr. Chen challenges the new municipal tax regulation in Manila.,1,0,0,0,0,0
Amit is charged with theft at Shanghai mall.,0,1,0,0,0,0
Government hiring procedure disputed by Aaradhya from Vishakhapatnam.,1,0,0,0,0,0
Custody battle between Jatin and Prashant in Rome family court.,0,0,0,0,1,0
Aditya is charged with theft at Berlin mall. Petition filed by Shivam regarding violation of free speech rights.,0,1,0,1,0,0
Police arrest Gukesh in Cape Town for organized financial fraud.,0,1,0,0,0,0
Government hiring procedure disputed by David from Abu Dhabi.,1,0,0,0,0,0
Prashant is charged with theft at Dubai mall.,0,1,0,0,0,0
