case_text,administrative,criminal,civil,constitutional,family,commercial
Property ownership between Harvijay and Jyotir contested in Paris court. John and Fatima file for divorce citing irreconcilable differences.,0,0,1,0,1,0
Salman files lawsuit against Aaradhya for breach of partnership terms. Mr. John challenges the new municipal tax regulation in Singapore.,1,0,0,0,0,1
Custody battle between Mahesh and Kunal in Singapore family court.,0,0,0,0,1,0
Property ownership between Anushka and Yash contested in Bnaglore court. Custody battle between Raj and Tanmay in Amsterdam family court.,0,0,1,0,1,0
Citizens in Manchester protest changes in election laws.,0,0,0,1,0,0
Police arrest Harvijay in Istanbul for organized financial fraud. Petition filed by Piyush regarding violation of free speech rights.,0,1,0,1,0,0
Police arrest Shivam in Kashmir for organized financial fraud.,0,1,0,0,0,0
Mr. Titiksha challenges the new municipal tax regulation in Delhi.,1,0,0,0,0,0
Police arrest Rohit in Manchester for organized financial fraud.,0,1,0,0,0,0
Anshika sues Amit over sudden rental agreement termination.,0,0,1,0,0,0
Monika and Aman file for divorce citing irreconcilable differences.,0,0,0,0,1,0
Property ownership between Mukti and Sunita contested in Abu Dhabi court.,0,0,1,0,0,0
Tanmay is charged with theft at Shanghai mall.,0,1,0,0,0,0
Petition filed by Aaradhya regarding violation of free speech rights.,0,0,0,1,0,0
Police arrest Rohit in Kuala Lumpur for organized financial fraud. Petition filed by Shivam regarding violation of free speech rights.,0,1,0,1,0,0
Police arrest kshitij in Madrid for organized financial fraud. Petition filed by Fatima regarding violation of free speech rights.,0,1,0,1,0,0
Harvijay files lawsuit against Kunal for breach of partnership terms.,0,0,0,0,0,1
Startup Barclays sues ex-employee Ramesh for leaking trade secrets. Government hiring procedure disputed by Anjali from Doha.,1,0,0,0,0,1
Anushree files lawsuit against Himanshi for breach of partnership terms.,0,0,0,0,0,1
Shivam sues Harvijay over sudden rental agreement termination.,0,0,1,0,0,0
Police arrest Harvijay in Manila for organized financial fraud.,0,1,0,0,0,0
Startup Qatar Airways sues ex-employee Rakesh for leaking trade secrets. Mr. Rakesh challenges the new municipal tax regulation in Shanghai.,1,0,0,0,0,1
Simran is charged with theft at Buenos Aires mall. Petition filed by Jyotir regarding violation of free speech rights.,0,1,0,1,0,0
Government hiring procedure disputed by Sudhir from Tokyo.,1,0,0,0,0,0
Government hiring procedure disputed by Aditya from Jakarta.,1,0,0,0,0,0
Monika is charged with theft at Osaka mall.,0,1,0,0,0,0
Petition filed by Sara regarding violation of free speech rights.,0,0,0,1,0,0
Startup Honeywell sues ex-employee Sunita for leaking trade secrets. Mr. Simran challenges the new municipal tax regulation in Jakarta.,1,0,0,0,0,1
Sunita files lawsuit against Harvijay for breach of partnership terms.,0,0,0,0,0,1
Startup ExxonMobil sues ex-employee Shubham for leaking trade secrets. Mr. David challenges the new municipal tax regulation in Singapore.,1,0,0,0,0,1
Priya is charged with theft at Singapore mall.,0,1,0,0,0,0
Police arrest Monika in Dehradun for organized financial fraud.,0,1,0,0,0,0
Police arrest Sudhir in Pune for organized financial fraud. Petition filed by Anjali regarding violation of free speech rights.,0,1,0,1,0,0
Property ownership between Kunal and kshitij contested in Shanghai court. Startup Hilton Hotels sues ex-employee Sunita for leaking trade secrets.,0,0,1,0,0,1
Custody battle between Sudhir and Rakesh in Chennai family court.,0,0,0,0,1,0
Petition filed by Sudhir regarding violation of free speech rights.,0,0,0,1,0,0
Startup Tata Motors sues ex-employee Shubham for leaking trade secrets.,0,0,0,0,0,1
Government hiring procedure disputed by Raj from Johannesburg.,1,0,0,0,0,0
Anshika sues Aditya over sudden rental agreement termination.,0,0,1,0,0,0
Rakesh sues Kartikey over sudden rental agreement termination.,0,0,1,0,0,0
Police arrest Priya in Brussels for organized financial fraud. Petition filed by Aman regarding violation of free speech rights.,0,1,0,1,0,0
Fatima and Anushka file for divorce citing irreconcilable differences.,0,0,0,0,1,0
Police arrest Utkarsh in Melbourne for organized financial fraud.,0,1,0,0,0,0
Property ownership between Shubham and Anushka contested in Doha court. Sukesh files lawsuit against Himanshi for breach of partnership terms.,0,0,1,0,0,1
Rohit sues Kunal over sudden rental agreement termination.,0,0,1,0,0,0
Petition filed by Titiksha regarding violation of free speech rights.,0,0,0,1,0,0
Startup General Motors sues ex-employee Gukesh for leaking trade secrets. Government hiring procedure disputed by Priya from Bnaglore.,1,0,0,0,0,1
Petition filed by Kartikey regarding violation of free speech rights.,0,0,0,1,0,0
Property ownership between Akshay and Sunita contested in New York court.,0,0,1,0,0,0
Startup PepsiCo sues ex-employee Monika for leaking trade secrets. Mr. Mahesh challenges the new municipal tax regulation in Melbourne.,1,0,0,0,0,1
Police arrest Prashant in Madrid for organized financial fraud.,0,1,0,0,0,0
Citizens in Singapore protest changes in election laws. Government hiring procedure disputed by Rakesh from Doha.,1,0,0,1,0,0
Tanmay sues Rakesh over sudden rental agreement termination. Custody battle between Gukesh and Kartikey in Singapore family court.,0,0,1,0,1,0
Petition filed by Rohit regarding violation of free speech rights.,0,0,0,1,0,0
Sukesh is charged with theft at Kerela mall.,0,1,0,0,0,0
Startup Tencent sues ex-employee Rakesh for leaking trade secrets. Mr. Akshay challenges the new municipal tax regulation in Barcelona.,1,0,0,0,0,1
Startup American Express sues ex-employee Piyush for leaking trade secrets. Mr. Anjali challenges the new municipal tax regulation in Jakarta.,1,0,0,0,0,1
Police arrest Utkarsh in Mexico City for organized financial fraud.,0,1,0,0,0,0
Startup Bosch sues ex-employee Piyush for leaking trade secrets.,0,0,0,0,0,1
Utkarsh is charged with theft at Manila mall.,0,1,0,0,0,0
Mukti files lawsuit against kshitij for breach of partnership terms.,0,0,0,0,0,1
Property ownership between Aaradhya and Sara contested in Mexico City court.,0,0,1,0,0,0
Petition filed by Anushree regarding violation of free speech rights.,0,0,0,1,0,0
Rohit files lawsuit against Ramesh for breach of partnership terms. Mr. Kunal challenges the new municipal tax regulation in Brisbane.,1,0,0,0,0,1
Shubham and Aman file for divorce citing irreconcilable differences.,0,0,0,0,1,0
Startup TCS sues ex-employee Sara for leaking trade secrets.,0,0,0,0,0,1
Prashant and Piyush file for divorce citing irreconcilable differences.,0,0,0,0,1,0
Shubham and John file for divorce citing irreconcilable differences.,0,0,0,0,1,0
Jyotir and Gukesh file for divorce citing irreconcilable differences.,0,0,0,0,1,0
Startup American Express sues ex-employee Mohit for leaking trade secrets.,0,0,0,0,0,1
Startup Hyundai sues ex-employee David for leaking trade secrets.,0,0,0,0,0,1
Petition filed by Arpita regarding violation of free speech rights.,0,0,0,1,0,0
Property ownership between Salman and Arpita contested in Goa court.,0,0,1,0,0,0
Government hiring procedure disputed by Aaradhya from Lima.,1,0,0,0,0,0
Police arrest Anshika in Moscow for organized financial fraud.,0,1,0,0,0,0
John and Ayesha file for divorce citing irreconcilable differences.,0,0,0,0,1,0
Sudhir is charged with theft at São Paulo mall.,0,1,0,0,0,0
Startup Citibank sues ex-employee Arpita for leaking trade secrets.,0,0,0,0,0,1
Startup Yum! Brands sues ex-employee Utkarsh for leaking trade secrets. Government hiring procedure disputed by Utkarsh from Dubai.,1,0,0,0,0,1
Citizens in Seoul protest changes in election laws. Government hiring procedure disputed by Mukti from Cairo.,1,0,0,1,0,0
Citizens in Lima protest changes in election laws.,0,0,0,1,0,0
Anushree is charged with theft at Mexico City mall.,0,1,0,0,0,0
Kartikey sues Simran over sudden rental agreement termination. Tanmay and Aman file for divorce citing irreconcilable differences.,0,0,1,0,1,0
Custody battle between John and Aditya in Seoul family court.,0,0,0,0,1,0
Government hiring procedure disputed by Aman from Chennai.,1,0,0,0,0,0
Petition filed by Salman regarding violation of free speech rights.,0,0,0,1,0,0
Citizens in Chennai protest changes in election laws. Mr. Sudhir challenges the new municipal tax regulation in Jakarta.,1,0,0,1,0,0
Amit files lawsuit against Priya for breach of partnership terms.,0,0,0,0,0,1
Gukesh is charged with theft at Dubai mall. Petition filed by Shivam regarding violation of free speech rights.,0,1,0,1,0,0
Mr. Tanmay challenges the new municipal tax regulation in Sydney.,1,0,0,0,0,0
Simran sues Rohit over sudden rental agreement termination.,0,0,1,0,0,0
Police arrest Prashant in Moscow for organized financial fraud.,0,1,0,0,0,0
Police arrest Simran in Kuala Lumpur for organized financial fraud. Petition filed by Amit regarding violation of free speech rights.,0,1,0,1,0,0
Police arrest Aman in Bangkok for organized financial fraud.,0,1,0,0,0,0
Citizens in Goa protest changes in election laws. Mr. Arpita challenges the new municipal tax regulation in Kuala Lumpur.,1,0,0,1,0,0
Mr. Himanshi challenges the new municipal tax regulation in Cairo.,1,0,0,0,0,0
John sues Arpita over sudden rental agreement termination. Custody battle between Harvijay and Simran in São Paulo family court.,0,0,1,0,1,0
Simran is charged with theft at Sydney mall.,0,1,0,0,0,0
Petition filed by Ramesh regarding violation of free speech rights.,0,0,0,1,0,0
Citizens in Johannesburg protest changes in election laws. Mr. Anjali challenges the new municipal tax regulation in Bangkok.,1,0,0,1,0,0
Police arrest David in Manchester for organized financial fraud.,0,1,0,0,0,0
Ramesh sues Kartikey over sudden rental agreement termination. Anshika files lawsuit against Piyush for breach of partnership terms.,0,0,1,0,0,1
Property ownership between Ayesha and Sudhir contested in Bangkok court.,0,0,1,0,0,0
kshitij sues Amit over sudden rental agreement termination. Custody battle between Shubham and Shouryan in Dehradun family court.,0,0,1,0,1,0
Simran is charged with theft at Beijing mall.,0,1,0,0,0,0
Citizens in Manchester protest changes in election laws.,0,0,0,1,0,0
Property ownership between Chen and Fatima contested in Brisbane court.,0,0,1,0,0,0
Startup Netflix sues ex-employee David for leaking trade secrets.,0,0,0,0,0,1
Citizens in Vishakhapatnam protest changes in election laws.,0,0,0,1,0,0
Citizens in Chennai protest changes in election laws. Mr. Ramesh challenges the new municipal tax regulation in Chennai.,1,0,0,1,0,0
Police arrest Kartikey in Jammu for organized financial fraud.,0,1,0,0,0,0
Government hiring procedure disputed by Amit from Singapore.,1,0,0,0,0,0
Mr. Monika challenges the new municipal tax regulation in Amsterdam.,1,0,0,0,0,0
Property ownership between Ramesh and Shivam contested in Brisbane court. Custody battle between Shubham and Mukti in Vishakhapatnam family court.,0,0,1,0,1,0
Police arrest Kunal in Barcelona for organized financial fraud. Citizens in Vishakhapatnam protest changes in election laws.,0,1,0,1,0,0
Petition filed by Anshika regarding violation of free speech rights.,0,0,0,1,0,0
Government hiring procedure disputed by Shouryan from Singapore.,1,0,0,0,0,0
Mr. Jyotir challenges the new municipal tax regulation in Mumbai.,1,0,0,0,0,0
Petition filed by Titiksha regarding violation of free speech rights. Mr. Kunal challenges the new municipal tax regulation in Shanghai.,1,0,0,1,0,0
Mr. Chen challenges the new municipal tax regulation in Manchester.,1,0,0,0,0,0
Property ownership between Tanmay and Salman contested in Istanbul court.,0,0,1,0,0,0
Police arrest Anshika in Bangkok for organized financial fraud.,0,1,0,0,0,0
Property ownership between Kunal and Piyush contested in Pune court. Arpita files lawsuit against Shubham for breach of partnership terms.,0,0,1,0,0,1
Prashant sues Anjali over sudden rental agreement termination.,0,0,1,0,0,0
Petition filed by Piyush regarding violation of free speech rights.,0,0,0,1,0,0
Fatima sues kshitij over sudden rental agreement termination. Piyush files lawsuit against John for breach of partnership terms.,0,0,1,0,0,1
Custody battle between Ayesha and Arpita in Dubai family court.,0,0,0,0,1,0
Property ownership between Jyotir and Tanmay contested in Beijing court.,0,0,1,0,0,0
Mr. Mohit challenges the new municipal tax regulation in Kuala Lumpur.,1,0,0,0,0,0
Property ownership between Anushree and Aaradhya contested in Beijing court.,0,0,1,0,0,0
Petition filed by Anushree regarding violation of free speech rights.,0,0,0,1,0,0
Startup Salesforce sues ex-employee Amit for leaking trade secrets. Government hiring procedure disputed by Kunal from Istanbul.,1,0,0,0,0,1
Mr. Amit challenges the new municipal tax regulation in Moscow.,1,0,0,0,0,0
Salman and Ramesh file for divorce citing irreconcilable differences.,0,0,0,0,1,0
Police arrest Sukesh in Osaka for organized financial fraud.,0,1,0,0,0,0
Sunita is charged with theft at Brussels mall. Citizens in Goa protest changes in election laws.,0,1,0,1,0,0
Police arrest Anushka in Brussels for organized financial fraud.,0,1,0,0,0,0
Property ownership between Jatin and Rakesh contested in Kerela court. Salman files lawsuit against Fatima for breach of partnership terms.,0,0,1,0,0,1
Utkarsh sues Mukti over sudden rental agreement termination. Raj files lawsuit against Shubham for breach of partnership terms.,0,0,1,0,0,1
Chen files lawsuit against Jyotir for breach of partnership terms. Mr. Titiksha challenges the new municipal tax regulation in Osaka.,1,0,0,0,0,1
Custody battle between Raj and Raj in Rome family court.,0,0,0,0,1,0
Ramesh files lawsuit against Sudhir for breach of partnership terms.,0,0,0,0,0,1
Anshika files lawsuit against Titiksha for breach of partnership terms. Mr. Sudhir challenges the new municipal tax regulation in Kerela.,1,0,0,0,0,1
Mr. Shubham challenges the new municipal tax regulation in Jammu.,1,0,0,0,0,0
Omar sues Amit over sudden rental agreement termination. Custody battle between Gukesh and Omar in Rome family court.,0,0,1,0,1,0
Mukti files lawsuit against Anushka for breach of partnership terms.,0,0,0,0,0,1
Startup Marriott International sues ex-employee Yash for leaking trade secrets. Mr. Jatin challenges the new municipal tax regulation in Sydney.,1,0,0,0,0,1
Property ownership between Prashant and Sudhir contested in Kerela court. Custody battle between Sunita and Shouryan in Manila family court.,0,0,1,0,1,0
Government hiring procedure disputed by Himanshi from Pune.,1,0,0,0,0,0
Prashant files lawsuit against Ramesh for breach of partnership terms. Mr. Mohit challenges the new municipal tax regulation in Lima.,1,0,0,0,0,1
Aaradhya and Amit file for divorce citing irreconcilable differences.,0,0,0,0,1,0
Property ownership between Fatima and Gukesh contested in Pune court.,0,0,1,0,0,0
Police arrest Anjali in Rome for organized financial fraud.,0,1,0,0,0,0
Police arrest Raj in Jammu for organized financial fraud. Citizens in Doha protest changes in election laws.,0,1,0,1,0,0
Kartikey is charged with theft at Bnaglore mall. Citizens in Jammu protest changes in election laws.,0,1,0,1,0,0
Mr. Rakesh challenges the new municipal tax regulation in Cape Town.,1,0,0,0,0,0
Mr. Yash challenges the new municipal tax regulation in Kuala Lumpur.,1,0,0,0,0,0
Mr. Aditya challenges the new municipal tax regulation in Amsterdam.,1,0,0,0,0,0
John sues Ramesh over sudden rental agreement termination. Startup AT&T sues ex-employee Shubham for leaking trade secrets.,0,0,1,0,0,1
Petition filed by Mukti regarding violation of free speech rights.,0,0,0,1,0,0
Petition filed by Fatima regarding violation of free speech rights. Mr. Kartikey challenges the new municipal tax regulation in Moscow.,1,0,0,1,0,0
Custody battle between Amit and Anshika in Melbourne family court.,0,0,0,0,1,0
Custody battle between Omar and kshitij in Paris family court.,0,0,0,0,1,0
Petition filed by Priya regarding violation of free speech rights.,0,0,0,1,0,0
Citizens in Mumbai protest changes in election laws. Mr. Rakesh challenges the new municipal tax regulation in Singapore.,1,0,0,1,0,0
Citizens in Dubai protest changes in election laws.,0,0,0,1,0,0
Police arrest Ayesha in Johannesburg for organized financial fraud. Citizens in Goa protest changes in election laws.,0,1,0,1,0,0
Police arrest Anushree in Dehradun for organized financial fraud. Petition filed by Anushka regarding violation of free speech rights.,0,1,0,1,0,0
Property ownership between Aditya and Kartikey contested in Brussels court.,0,0,1,0,0,0
Petition filed by Anshika regarding violation of free speech rights. Mr. Salman challenges the new municipal tax regulation in New York.,1,0,0,1,0,0
Citizens in Shanghai protest changes in election laws.,0,0,0,1,0,0
Mr. Anushree challenges the new municipal tax regulation in Goa.,1,0,0,0,0,0
Property ownership between Kartikey and Anushree contested in Dubai court. Startup Johnson & Johnson sues ex-employee kshitij for leaking trade secrets.,0,0,1,0,0,1
Citizens in Rome protest changes in election laws.,0,0,0,1,0,0
Yash sues Anshika over sudden rental agreement termination.,0,0,1,0,0,0
Property ownership between Aaradhya and Amit contested in Istanbul court.,0,0,1,0,0,0
Himanshi is charged with theft at Tokyo mall. Petition filed by Tanmay regarding violation of free speech rights.,0,1,0,1,0,0
Government hiring procedure disputed by Shivam from Moscow.,1,0,0,0,0,0
kshitij is charged with theft at Brussels mall.,0,1,0,0,0,0
Mohit is charged with theft at Mexico City mall. Citizens in Riyadh protest changes in election laws.,0,1,0,1,0,0
Citizens in Vishakhapatnam protest changes in election laws. Mr. Tanmay challenges the new municipal tax regulation in Shanghai.,1,0,0,1,0,0
Startup Honda sues ex-employee Prashant for leaking trade secrets.,0,0,0,0,0,1
Startup Delta Airlines sues ex-employee Anushree for leaking trade secrets. Mr. Mahesh challenges the new municipal tax regulation in Doha.,1,0,0,0,0,1
Jyotir files lawsuit against Arpita for breach of partnership terms. Government hiring procedure disputed by Anshika from Singapore.,1,0,0,0,0,1
Citizens in Cairo protest changes in election laws.,0,0,0,1,0,0
Mr. Anshika challenges the new municipal tax regulation in Goa.,1,0,0,0,0,0
Property ownership between Rohit and Arpita contested in Kashmir court.,0,0,1,0,0,0
Priya files lawsuit against Gukesh for breach of partnership terms.,0,0,0,0,0,1
Mr. Prashant challenges the new municipal tax regulation in Beijing.,1,0,0,0,0,0
Mr. Tanmay challenges the new municipal tax regulation in Bangkok.,1,0,0,0,0,0
Petition filed by Shivam regarding violation of free speech rights. Mr. kshitij challenges the new municipal tax regulation in Istanbul.,1,0,0,1,0,0
Property ownership between Tanmay and Sara contested in Madrid court.,0,0,1,0,0,0
Mr. Mukti challenges the new municipal tax regulation in Manchester.,1,0,0,0,0,0
Mohit is charged with theft at Seoul mall. Petition filed by Sunita regarding violation of free speech rights.,0,1,0,1,0,0
Prashant sues Chen over sudden rental agreement termination. Utkarsh and Simran file for divorce citing irreconcilable differences.,0,0,1,0,1,0
Mr. Amit challenges the new municipal tax regulation in Pune.,1,0,0,0,0,0
Police arrest Jatin in Kuala Lumpur for organized financial fraud. Petition filed by Anushka regarding violation of free speech rights.,0,1,0,1,0,0
Property ownership between Tanmay and Shouryan contested in Bangkok court.,0,0,1,0,0,0
Citizens in Pune protest changes in election laws. Mr. Monika challenges the new municipal tax regulation in Amsterdam.,1,0,0,1,0,0
Prashant is charged with theft at Doha mall. Citizens in London protest changes in election laws.,0,1,0,1,0,0
Petition filed by Anushka regarding violation of free speech rights.,0,0,0,1,0,0
Police arrest Prashant in Kerela for organized financial fraud.,0,1,0,0,0,0
Custody battle between Priya and Akshay in Cape Town family court.,0,0,0,0,1,0
Petition filed by Aditya regarding violation of free speech rights.,0,0,0,1,0,0
Police arrest Anjali in Jakarta for organized financial fraud. Petition filed by Aaradhya regarding violation of free speech rights.,0,1,0,1,0,0
Property ownership between Chen and Mukti contested in Madrid court. Startup BMW sues ex-employee Piyush for leaking trade secrets.,0,0,1,0,0,1
Startup Goldman Sachs sues ex-employee Titiksha for leaking trade secrets. Government hiring procedure disputed by Himanshi from Berlin.,1,0,0,0,0,1
Property ownership between Mukti and Harvijay contested in Jakarta court. Amit files lawsuit against Priya for breach of partnership terms.,0,0,1,0,0,1
Harvijay files lawsuit against Tanmay for breach of partnership terms.,0,0,0,0,0,1
Petition filed by Aditya regarding violation of free speech rights.,0,0,0,1,0,0
Petition filed by Shouryan regarding violation of free speech rights. Government hiring procedure disputed by Mukti from Jammu.,1,0,0,1,0,0
Property ownership between Aditya and Mohit contested in London court. Custody battle between Rohit and Jatin in Goa family court.,0,0,1,0,1,0
Yash sues Shubham over sudden rental agreement termination.,0,0,1,0,0,0
Rohit files lawsuit against Anushka for breach of partnership terms. Mr. Rohit challenges the new municipal tax regulation in Delhi.,1,0,0,0,0,1
Shivam and Monika file for divorce citing irreconcilable differences.,0,0,0,0,1,0
Citizens in Dehradun protest changes in election laws. Government hiring procedure disputed by Shivam from Johannesburg.,1,0,0,1,0,0
Kartikey files lawsuit against Mohit for breach of partnership terms. Mr. Sukesh challenges the new municipal tax regulation in Delhi.,1,0,0,0,0,1
Akshay and Omar file for divorce citing irreconcilable differences.,0,0,0,0,1,0
Government hiring procedure disputed by Omar from Sydney.,1,0,0,0,0,0
Aaradhya files lawsuit against Titiksha for breach of partnership terms.,0,0,0,0,0,1
Startup PayPal sues ex-employee Mukti for leaking trade secrets.,0,0,0,0,0,1
Fatima sues David over sudden rental agreement termination.,0,0,1,0,0,0
Anshika files lawsuit against Kartikey for breach of partnership terms. Mr. Sukesh challenges the new municipal tax regulation in Mumbai.,1,0,0,0,0,1
Property ownership between Titiksha and Utkarsh contested in Kerela court. Prashant and Sunita file for divorce citing irreconcilable differences.,0,0,1,0,1,0
Citizens in Tokyo protest changes in election laws.,0,0,0,1,0,0
Startup Wells Fargo sues ex-employee Salman for leaking trade secrets.,0,0,0,0,0,1
Sara sues Mahesh over sudden rental agreement termination.,0,0,1,0,0,0
Police arrest Ayesha in New York for organized financial fraud.,0,1,0,0,0,0
Himanshi files lawsuit against Aaradhya for breach of partnership terms.,0,0,0,0,0,1
Property ownership between Chen and Kunal contested in Mexico City court. Prashant and Titiksha file for divorce citing irreconcilable differences.,0,0,1,0,1,0
Police arrest Piyush in Cape Town for organized financial fraud.,0,1,0,0,0,0
Priya sues Rohit over sudden rental agreement termination. Custody battle between Shivam and Tanmay in Seoul family court.,0,0,1,0,1,0
Property ownership between Omar and Gukesh contested in Cairo court. Custody battle between Yash and Prashant in Sydney family court.,0,0,1,0,1,0
Mr. Utkarsh challenges the new municipal tax regulation in Delhi.,1,0,0,0,0,0
Government hiring procedure disputed by kshitij from Moscow.,1,0,0,0,0,0
Property ownership between Omar and Kartikey contested in Cairo court.,0,0,1,0,0,0
Monika sues Raj over sudden rental agreement termination. Chen and Anjali file for divorce citing irreconcilable differences.,0,0,1,0,1,0
Shouryan is charged with theft at Barcelona mall. Citizens in Tokyo protest changes in election laws.,0,1,0,1,0,0
Citizens in Amsterdam protest changes in election laws.,0,0,0,1,0,0
Citizens in Kerela protest changes in election laws. Government hiring procedure disputed by Mahesh from Barcelona.,1,0,0,1,0,0
Property ownership between Sara and Akshay contested in Jammu court.,0,0,1,0,0,0
Property ownership between Omar and Rakesh contested in Kerela court.,0,0,1,0,0,0
Citizens in Melbourne protest changes in election laws.,0,0,0,1,0,0
Startup TotalEnergies sues ex-employee kshitij for leaking trade secrets.,0,0,0,0,0,1
Mr. John challenges the new municipal tax regulation in Jakarta.,1,0,0,0,0,0
Sunita sues David over sudden rental agreement termination. Piyush files lawsuit against Prashant for breach of partnership terms.,0,0,1,0,0,1
Startup American Express sues ex-employee Ayesha for leaking trade secrets.,0,0,0,0,0,1
Startup Vodafone sues ex-employee Prashant for leaking trade secrets.,0,0,0,0,0,1
Property ownership between Aaradhya and Tanmay contested in Mexico City court. Startup Microsoft sues ex-employee Mahesh for leaking trade secrets.,0,0,1,0,0,1
Gukesh and Prashant file for divorce citing irreconcilable differences.,0,0,0,0,1,0
Citizens in Berlin protest changes in election laws.,0,0,0,1,0,0
Police arrest Gukesh in Manchester for organized financial fraud.,0,1,0,0,0,0
Government hiring procedure disputed by Arpita from Vishakhapatnam.,1,0,0,0,0,0
Government hiring procedure disputed by Prashant from Mexico City.,1,0,0,0,0,0
Property ownership between Kunal and Anshika contested in Kerela court. Titiksha files lawsuit against John for breach of partnership terms.,0,0,1,0,0,1
Government hiring procedure disputed by Rohit from Vishakhapatnam.,1,0,0,0,0,0
Anshika sues Priya over sudden rental agreement termination. Startup IKEA sues ex-employee Sara for leaking trade secrets.,0,0,1,0,0,1
